{
  "actor": "37chengshan",
  "createdAt": "2026-07-29T22:42:01+08:00",
  "entityId": "T-20260729-E7RP",
  "entityType": "task",
  "id": "E-20260729-224201-BEM5",
  "kind": "testResult",
  "message": "最终更正 2026-07-29 软件切片结果：根据彩格 PETG 实物标签，将喷嘴 235～270 ℃、热床 80～90 ℃、常规速度 40～100 mm/s 纳入硬校验；根据 Grok 独立审查，将 auto_brim 改为固定 outer_only 7 mm，并把对象标记外的 brim 挤出、5 mm 床边余量、未归属首层挤出和包含 brim 的实际足迹重叠加入校验。重生成后 10/10 STL 闭合通过；3 份完整 G-code 与 3 份首层验证 G-code 均 3/3 通过，对象数 1/1/11，命名对象及 brim 足迹重叠均为 0，未归属首层挤出均为 0。盘 1/2/3 首层全部挤出范围分别为 9.361～290.639、10.361～289.639、X 7.488～292.512/Y 37.708～262.292 mm；估算 615.71 g、1d 22h 57m 11s。该事件取代 E-20260729-214150-J56F 的旧 auto_brim 估算。",
  "recordType": "event",
  "schemaVersion": 1,
  "supersedesEventId": "E-20260729-214150-J56F"
}
