{
  "actor": "37chengshan",
  "createdAt": "2026-07-29T16:35:16+08:00",
  "entityId": "T-20260729-E7RP",
  "entityType": "task",
  "id": "E-20260729-163516-2040",
  "kind": "testResult",
  "message": "v0.1 试装版已生成并重新加载验证 21 个 STL：退化三角形和开放边均为 0；钥匙名义包络 92×55.1×38 mm，门锁名义包络 Ø596×84 mm，均通过官方包络；全部单件通过暂定 180×180 mm 热床检查。相接封闭实体存在切片器需自动合并的非流形重边，已在报告逐件列出，尚未进行真实切片和实物打印。",
  "recordType": "event",
  "schemaVersion": 1
}
