{
  "actor": "37chengshan",
  "createdAt": "2026-07-29T21:41:50+08:00",
  "entityId": "T-20260729-E7RP",
  "entityType": "task",
  "id": "E-20260729-214150-J56F",
  "kind": "testResult",
  "message": "2026-07-29 重新生成 v0.3 几何与切片：10/10 STL 重载闭合检查通过且重生成前后 STL SHA-256 不变；OrcaSlicer 2.4.2 使用确定性逐盘标准 3MF、关闭自动排布后导出 3 份完整 G-code。完整 G-code 与三份首层验证 G-code 均 3/3 通过，首层识别对象数分别为 1、1、11，三盘对象包络重叠均为 0；打印温度目标 235/240 ℃位于材料 235～270 ℃范围内，常规速度 40～100 mm/s 约束已纳入配置。用户现场确认移除床面残留层后打印恢复正常；该反馈不等于整盘打印或装配通过。",
  "recordType": "event",
  "schemaVersion": 1
}
