{
  "actor": "37chengshan",
  "createdAt": "2026-07-30T22:09:51+00:00",
  "entityId": "T-20260729-6H2Q",
  "entityType": "task",
  "id": "E-20260730-220951-8D05",
  "kind": "testResult",
  "message": "2026-07-30 最终两基站数据共 18 组。稀疏模型在 0.5～1.5 m 训练标定点上的距离最大误差约 0.112 m、P95 约 0.103 m；实时距离仍有明显波动。现有 -15°/0°/+15° 角度显示与真实方向不符，角度判定为不可用，禁止参与开锁。已创建扩展距离、角度可观测性、实时稳定性和独立验证四项后续任务。",
  "recordType": "event",
  "schemaVersion": 1
}
